{
  "id": "aqm-verdict",
  "brief_id": "aqm-brief",
  "landscape_id": "aqm-landscape",
  "decisions": [
    { "capability_id": "C1", "verdict": "KEEP", "chosen_candidate": "cand-pm", "rationale": "Commodity PM2.5 module measured within the Bar on the bench; ESPHome already reads it. Nothing to build.", "keep_cost_note": "18 USD per unit; replace every 2-3 years", "evidence": [ { "kind": "measurement", "locator": "canvass/pm-bench.csv", "summary": "15% vs reference over 6 h", "captured_at": "2026-10-23T16:00:00Z", "captured_by": "scout", "confidence": 0.85, "grade": "measured" } ], "confidence": 0.9 },
    { "capability_id": "C2", "verdict": "KEEP", "chosen_candidate": "cand-co2", "rationale": "NDIR module measured within the Bar; ESPHome already reads it.", "keep_cost_note": "25 USD per unit", "evidence": [ { "kind": "measurement", "locator": "canvass/co2-bench.csv", "summary": "60 ppm vs reference", "captured_at": "2026-10-23T16:00:00Z", "captured_by": "scout", "confidence": 0.85, "grade": "measured" } ], "confidence": 0.9 },
    { "capability_id": "C3", "verdict": "KEEP", "chosen_candidate": "cand-ha", "rationale": "Local notifications measured under 5 s; thresholds set in the app; no cloud path, so the security threshold is met. The consumer product fails the Bar on privacy and cost.", "keep_cost_note": "~0.9 USD/month power for the host", "evidence": [ { "kind": "log", "locator": "canvass/ha-trial.log", "summary": "notification timing on LAN", "captured_at": "2026-10-23T15:00:00Z", "captured_by": "scout", "confidence": 0.9, "grade": "tried" } ], "confidence": 0.95 },
    { "capability_id": "C4", "verdict": "KEEP", "chosen_candidate": "cand-ha", "rationale": "Recorder retention is configurable to 30+ days; history view exists on the phone.", "evidence": [ { "kind": "log", "locator": "canvass/ha-trial.log", "summary": "recorder retention configured", "captured_at": "2026-10-23T15:00:00Z", "captured_by": "scout", "confidence": 0.9, "grade": "tried" } ], "confidence": 0.9 },
    { "capability_id": "C5", "verdict": "BEND", "chosen_candidate": "cand-esphome", "delta": "Configure reboot-on-Wi-Fi-loss and hardware watchdog; add a weekly forced-calibration routine for CO2; add a 'readings stopped' alert in Home Assistant; mains power; vented enclosure with a tool-free sensor door. Nothing else.", "rationale": "ESPHome gets most of the way; the Graveyard says reconnects, drift and dust are what kill these. The delta is configuration plus a small physical build, not a new system.", "evidence": [ { "kind": "memory", "locator": "landscape.json#graveyard", "summary": "grave-drift, grave-reconnect", "captured_at": "2026-10-24T09:00:00Z", "captured_by": "judge", "confidence": 0.85, "grade": "found" } ], "confidence": 0.8 },
    { "capability_id": "C6", "verdict": "BUILD", "rationale": "No candidate produces a monthly plain-language summary with calibration status. It is a small scheduled script against Home Assistant's history API; the Prospector's ROM is under two days of work. Priority is 'could', so it is sequenced last and may be cut without touching the others.", "why_not_keep": "cand-ha best fit 0.4: sends scheduled messages but has no trend narrative or calibration status; cand-consumer (0.5) fails security and cost thresholds.", "why_not_bend": "Bending Home Assistant automations yields a message, not an assembled report with trends and calibration state; the logic is new regardless, so it is a BUILD against a kept API rather than a modification of a kept part.", "cited_candidates": ["cand-ha", "cand-consumer"], "evidence": [ { "kind": "log", "locator": "canvass/ha-trial.log", "summary": "no periodic report feature", "captured_at": "2026-10-23T15:00:00Z", "captured_by": "scout", "confidence": 0.8, "grade": "tried" } ], "confidence": 0.7 }
  ],
  "overall": "PROCEED",
  "overall_rationale": "Reuse ratio 0.83: four KEEP, one BEND, one small BUILD on a 'could' capability. Build scope is an enclosure, configuration, a calibration routine and one script. The want is met mostly by things that already exist.",
  "reuse_ratio": 0.83,
  "tripwires": [ { "condition": "A candidate appears that produces monthly narrative reports locally - turn C6 into KEEP", "by": "2027-04-23" } ],
  "signoffs": [
    { "by": "judge", "role": "judge", "at": "2026-10-24T09:30:00Z", "decision": "approve" },
    { "by": "human", "role": "human", "at": "2026-10-24T10:00:00Z", "decision": "approve", "note": "agree; cut C6 first if the build runs over" }
  ],
  "provenance": { "produced_by": "judge", "produced_at": "2026-10-24T09:30:00Z", "inputs": [ { "artifact": "brief", "path": "brief.json" }, { "artifact": "landscape", "path": "landscape.json" } ] }
}
